{
  "$schema": "http://json-schema.org/draft-07/schema#",
  "title": "RecipeSet",
  "description": "JSON Schema for wrt_relese Recipe Set presets with auto-completed recipe enum values",
  "type": "object",
  "required": [
    "name",
    "recipes"
  ],
  "properties": {
    "$schema": {
      "type": "string"
    },
    "name": {
      "type": "string",
      "description": "Unique identifier of the recipe set"
    },
    "description": {
      "type": "string",
      "description": "Detailed description of what this recipe set includes"
    },
    "recipes": {
      "type": "array",
      "description": "List of recipes enabled in this preset",
      "items": {
        "type": "string",
        "enum": [
          "airoha_an7581",
          "awg",
          "banip",
          "base",
          "bash_completion",
          "bdy_g98",
          "build_signature",
          "chinadns_ng",
          "cli_enhancements",
          "cloudflared",
          "core_enhancements",
          "crowdsec",
          "cudy_tr3000_114m",
          "default_theme_argon",
          "default_theme_fluent",
          "disable_adguardhome",
          "disable_coremark",
          "disable_ddns_go",
          "disable_docker_deps",
          "disable_easytier",
          "disable_initramfs",
          "disable_istorex",
          "disable_lucky",
          "disable_mosdns",
          "disable_oaf",
          "disable_openclash",
          "disable_passwall",
          "disable_pbr",
          "disable_smartdns",
          "disable_wireguard",
          "docker_compose",
          "docker_upgrade",
          "dockerman",
          "enable_istorex",
          "fix_kernel_magic",
          "flyline",
          "fwknopd",
          "h3c-hm2004-du_fttr",
          "hiddify_core",
          "homeproxy",
          "kernel_compress_lzma",
          "kernel_size_expand",
          "luci-app-upnp",
          "luci_app_airoha_npu",
          "luci_app_bandix",
          "luci_app_cpu_temp_status",
          "luci_app_daed",
          "luci_app_mtk_dash2",
          "luci_app_qosify",
          "luci_app_shadowrt",
          "luci_app_trafficctl",
          "luci_app_unishare",
          "luci_theme_argon",
          "luci_theme_fluent",
          "lxc",
          "mt7981",
          "mt7986",
          "mt798x_hnat",
          "mt798x_warp_config",
          "mwan3",
          "net_monitor",
          "net_optimize",
          "nikki",
          "oaf",
          "ohmyzsh",
          "openssh_sftp_server",
          "ophub_rootfs",
          "opkg_distfeeds",
          "passwall",
          "passwall2",
          "portweaver",
          "portweaver_lite",
          "qosmate",
          "sing_box_extended",
          "sing_box_extended_tiny",
          "sqm",
          "starship",
          "starship_mini",
          "storage_fs",
          "tailscale_awg",
          "upx",
          "use_apk",
          "vm_images",
          "wan_bonding",
          "wifi_ap_drivers",
          "zapret2",
          "zram"
        ]
      },
      "uniqueItems": true
    },
    "disable_recipes": {
      "type": "array",
      "description": "List of recipes explicitly disabled in this preset",
      "items": {
        "type": "string",
        "enum": [
          "airoha_an7581",
          "awg",
          "banip",
          "base",
          "bash_completion",
          "bdy_g98",
          "build_signature",
          "chinadns_ng",
          "cli_enhancements",
          "cloudflared",
          "core_enhancements",
          "crowdsec",
          "cudy_tr3000_114m",
          "default_theme_argon",
          "default_theme_fluent",
          "disable_adguardhome",
          "disable_coremark",
          "disable_ddns_go",
          "disable_docker_deps",
          "disable_easytier",
          "disable_initramfs",
          "disable_istorex",
          "disable_lucky",
          "disable_mosdns",
          "disable_oaf",
          "disable_openclash",
          "disable_passwall",
          "disable_pbr",
          "disable_smartdns",
          "disable_wireguard",
          "docker_compose",
          "docker_upgrade",
          "dockerman",
          "enable_istorex",
          "fix_kernel_magic",
          "flyline",
          "fwknopd",
          "h3c-hm2004-du_fttr",
          "hiddify_core",
          "homeproxy",
          "kernel_compress_lzma",
          "kernel_size_expand",
          "luci-app-upnp",
          "luci_app_airoha_npu",
          "luci_app_bandix",
          "luci_app_cpu_temp_status",
          "luci_app_daed",
          "luci_app_mtk_dash2",
          "luci_app_qosify",
          "luci_app_shadowrt",
          "luci_app_trafficctl",
          "luci_app_unishare",
          "luci_theme_argon",
          "luci_theme_fluent",
          "lxc",
          "mt7981",
          "mt7986",
          "mt798x_hnat",
          "mt798x_warp_config",
          "mwan3",
          "net_monitor",
          "net_optimize",
          "nikki",
          "oaf",
          "ohmyzsh",
          "openssh_sftp_server",
          "ophub_rootfs",
          "opkg_distfeeds",
          "passwall",
          "passwall2",
          "portweaver",
          "portweaver_lite",
          "qosmate",
          "sing_box_extended",
          "sing_box_extended_tiny",
          "sqm",
          "starship",
          "starship_mini",
          "storage_fs",
          "tailscale_awg",
          "upx",
          "use_apk",
          "vm_images",
          "wan_bonding",
          "wifi_ap_drivers",
          "zapret2",
          "zram"
        ]
      },
      "uniqueItems": true
    }
  },
  "additionalProperties": false
}
