{
  "$schema": "./recipe_set.schema.json",
  "name": "full",
  "description": "全功能完整集合（包含 Docker、全套 Proxy 网络加速与拓展）",
  "recipes": [
    "default_theme_fluent",
    "luci_theme_fluent",
    "fix_kernel_magic",
    "opkg_distfeeds",
    "awg",
    "zram",
    "cli_enhancements",
    "core_enhancements",
    "cloudflared",
    "dockerman",
    "docker_compose",
    "homeproxy",
    "hiddify_core",
    "sing_box_extended",
    "luci_app_daed",
    "luci_app_unishare",
    "luci_app_shadowrt",
    "lxc",
    "net_optimize",
    "oaf",
    "nikki",
    "starship",
    "flyline",
    "bash_completion",
    "passwall",
    "passwall2",
    "portweaver",
    "qosmate",
    "banip",
    "fwknopd",
    "crowdsec",
    "sqm",
    "storage_fs",
    "tailscale_awg",
    "upx",
    "vm_images",
    "wan_bonding",
    "mwan3",
    "luci-app-upnp",
    "zapret2",
    "enable_istorex",
    "disable_lucky",
    "disable_easytier",
    "disable_smartdns",
    "docker_upgrade",
    "luci_app_bandix",
    "luci_app_qosify",
    "luci_app_cpu_temp_status",
    "disable_wireguard",
    "use_apk",
    "openssh_sftp_server"
  ],
  "disable_recipes": [
    "default_theme_argon"
  ]
}
