{
  "$schema": "./recipe_set.schema.json",
  "name": "mini",
  "description": "轻量精简集合",
  "recipes": [
    "default_theme_fluent",
    "luci_theme_fluent",
    "fix_kernel_magic",
    "opkg_distfeeds",
    "awg",
    "zram",
    "core_enhancements",
    "net_optimize",
    "starship_mini",
    "qosmate",
    "tailscale_awg",
    "upx",
    "wan_bonding",
    "mwan3",
    "luci-app-upnp",
    "disable_lucky",
    "disable_easytier",
    "disable_smartdns",
    "disable_passwall",
    "disable_oaf",
    "disable_ddns_go",
    "disable_adguardhome",
    "disable_openclash",
    "disable_wireguard",
    "luci_app_cpu_temp_status",
    "use_apk",
    "vm_images",
    "portweaver_lite",
    "openssh_sftp_server"
  ],
  "disable_recipes": [
    "default_theme_argon"
  ]
}
